script_element,character,text
dialogue,Phoebe,Okay.
dialogue,Monica,Are you alright?
dialogue,Phoebe,"Yeah. It’s just, you know, it’s this whole stupid Ursula thing, it’s..."
dialogue,Rachel,"Okay, Pheebs, can I ask? So, he’s going out with her. I mean, is it really so terrible?"
dialogue,Phoebe,"Um, yeah. Look, I mean, I’m not saying she’s like evil or anything. She just, you know, she’s always breaking my stuff . When I was eight, and I wouldn’t let her have my Judy Jetson thermos, so she threw it under the bus. And then, oh, and then there was Randy Brown, who was like... Have you ever had a boyfriend who was like your best friend?"
dialogue,Monica and Rachel,"(Wistfully, shaking their heads) No."
dialogue,Phoebe,"Well, but that’s what he was for me. And she you know, kind of stole him away, and then... broke his heart... and then he wouldn’t even talk to me any more. Because he said he didn’t wanna be around... anything that looked like either one of us."
dialogue,Rachel,"Oh... Oh, Pheebs."
dialogue,Phoebe,"I mean, I know Joey is not my boyfriend, or my thermos, or anything, but..."
dialogue,Chandler,You’re not gonna lose him.
dialogue,Monica,"Hon, you gotta talk to Joey."
dialogue,Phoebe,Yeah. Okay.
dialogue,Ross,"No, come on, he doesn’t know this stuff. If he knew how you felt."
dialogue,Phoebe,But he’s falling in love with her.
dialogue,Rachel,"Oh please, they’ve been going out a week. They haven’t even slept together yet, I mean, that’s not serious."
dialogue,Phoebe,Okay... Okay.
action,,(Monica and Ross indicate that they mean right now.)
dialogue,Phoebe,"Oh, okay, oh."
action,,"(Phoebe gets up and walks across the hallway, but the door to Chandler and Joey’s apartment is shut. She knocks, and anxiously waits for Joey to come, but instead her identical twin sister emerges wearing one of Joey’s shirts.)"
dialogue,Ursula,(Surprised) Oh.
action,,"(Phoebe reels back in shock, while Ursula defiantly leans against the doorpost as though she owns the place.)"
dialogue,Ursula,"Yeah, um, may we help you?"
action,,Closing Credits
heading,,"[Scene: Monica and Rachel's Balcony, Rachel is taking down the Christmas lights. Monica sees her, so she leans out of the small side window.]"
dialogue,Monica,"Rachel, what are you doing? It’s freezing out here. Would you come back inside?"
dialogue,Rachel,"No no no no no. You wanted me to take them down, so... (she climbs onto the railing to reach the top of a pole) ..I’m takin’ ’em down. Okay? Whoa! (Screams.)"
action,,"(Rachel slips, loses her balance, and falls over the edge..)"
dialogue,Monica,Oh-my-god Rachel! (Rushing out to look over the edge) Rachel!
action,,"(In the apartment below, Mr.Heckles is trying to relax and read his newspaper, but Rachel is helplessly dangling upside-down with her ankle wrapped up in the Christmas lights.)"
dialogue,Rachel,"(To Monica) I’m okay! I’m okay! (She knocks on Mr. Heckles's window.) Mr. Heckles, Mr. Heckles could you help me please?"
dialogue,Mr.Heckles,"See, this is just the kind of thing I was talking about."
action,,End
