script_element,character,text
heading,,"[Scene: Chandler and Joey's, Joey is eating breakfast as Chandler comes out of his bedroom, ripping his coat in the process.]"
dialogue,Chandler,Wow! That ripped! That ripped real nice!
dialogue,Joey,"How many times do I have to tell you! Ya, turn and sliiiide! Y'know, turn and slide."
dialogue,Chandler,"You don’t turn and slide, you throw it out! I’m tired of having to get a tetanus shot every time I get dressed!"
dialogue,Joey,"Look, we’re not throwing it out! I built this thing with my own hands!"
dialogue,Chandler,"All right, how about we, how ‘bout we sell it."
dialogue,Joey,"All right. But, you’re gonna have to tell them. (He opens the cabinet to reveal the chick and the duck living inside with Christmas lights and a disco ball as decorations.)"
dialogue,Chandler,(nods his head) Do you mind if we stick you in another cabinet? (to Joey) They seem all right with it!
action,,Opening Credits
heading,,"[Scene: Monica and Rachel's, Monica and Ross are there. Monica is checking the messages.]"
dialogue,Chip,"(on machine) Hey Monica, it’s Chip."
dialogue,Monica,Yesss!!
dialogue,Ross,Who’s Chip?
dialogue,Monica,Shhh!
dialogue,Chip,"(on machine) Good runnin’ into you at the bank today, so ah, here’s my number, 555-9323. Give me a call. Later."
dialogue,Monica,"Chip, is Chip Matthews."
dialogue,Ross,The guy who took Rachel to the prom? Why is he calling you?
dialogue,Monica,"‘Cause I ran into him at the bank, he is still soo cute."
dialogue,Ross,"Monica, you’re so lucky! He’s like the most popular guy in school!!"
dialogue,Monica,"I know!! (calls him) (on phone) Chip? Hi! It’s Monica. (listens) ‘Kay. (listens) ‘Kay. (listens) Okay. (listens) Okay, good-bye. (hangs up) Oh my God, we just had the best conversation!! (goes into her room as Rachel enters)"
dialogue,Ross,(to Rachel) I was just leaving.
dialogue,Rachel,"Good! ‘Cause I’ve got a product report to read, it’s like eight pages, I hope I don’t fall asleep."
dialogue,Ross,Why? Did you write it?
dialogue,Rachel,"(sees Chip’s phone number) Wow! Look at that, Chip Matthews called. I wonder what he wants?"
dialogue,Ross,"Well ah, actually..."
dialogue,Rachel,(interrupting) I bet he sensed that I was ready to have sex with another guy.
dialogue,Ross,"Well, umm, why don’t you give him a call?"
dialogue,Rachel,Okay. (picks up phone) Are you sure you wanna hear this?
dialogue,Ross,"Oh, I’m sure."
dialogue,Rachel,"(on phone) Chip! Hi, it’s Rachel. (listens) Rachel Green. Yeah, umm, you left me a message. (listens) Yes you did, my roommate wrote it down. (listens) Monica Geller. (listens) Ohh."
dialogue,Ross,"(whispering in her ear) Oh, that’s right! He called to ask out Monica! That-that’s gotta be embarrassing!"
heading,,"[Scene: Central Perk, Phoebe is finishing up a song.]"
dialogue,Phoebe,"(screaming, angrily) ...DUMB, DRUNKEN, BITCH!!! (applause) (happily) Thank you, thanks."
dialogue,Ross,"(reading the newspaper) Hey, here’s a question; where did you guys get the finest oak East of the Mississippi?"
dialogue,Chandler,"Uh-huh, first you tell us where you got the prettiest lace in all the land."
dialogue,Ross,I’m reading your ad.
dialogue,Joey,"Looks good, uh?"
dialogue,Ross,Yeah.
dialogue,Chandler,"(reading the ad) Stunning entertainment center. Fine, (pause) fine Italian craftsmanship. (Joey is very proud of himself)"
dialogue,Phoebe,"Oh my God, you guys are selling the entertainment center?"
dialogue,Rachel,Why? I love that thing.
dialogue,Chandler,You want it?
dialogue,Phoebe and Rachel,Oh no.
dialogue,Chandler,"Ahh, Gepeto, $5,000 dollars? Are you insane?"
dialogue,Joey,"Hey, the ad alone cost 300 bucks!"
dialogue,Chandler,"All right look, I’m changing it to 50 bucks, or your best offer."
dialogue,Joey,What kind of profit is that?! And you call yourself an accountant.
dialogue,Chandler,(looks at him) Nooo.
dialogue,Joey,Oh. What do you do?
dialogue,Chandler,I can’t believe you don’t know what I do for a living!
dialogue,Phoebe,"Yeah, I actually don’t know..."
dialogue,Ross,"Good, so do I"
dialogue,Rachel,Something to do with numbers?
action,,[Cut to someone entering Central Perk which lets a cat in. The cat then runs over to Phoebe’s guitar case and starts sniffing around.]
dialogue,Phoebe,"Oh my God! No! Shoo! Kitty! No! No-no-no! Shoo! Come on, you! (goes over and picks up the cat) Come on. Crazy. (looks into the cat’s eyes) Oh my God."
dialogue,Rachel,What?
dialogue,Phoebe,Nothing. Nothing.
dialogue,Joey,What? What’s wrong?
dialogue,Phoebe,"I just, I just have this really strong feeling that this cat is my Mother."
dialogue,Rachel,You mean the mom you met in Montauk. She was a cat?!
dialogue,Phoebe,"No, no-no, she was a human lady. This is the spirit of my Mom Lily, the one who killed herself."
dialogue,Ross,"Are you sure she’s in the cat, or have you been taking your grandma’s glycoma medicine again?"
dialogue,Phoebe,"No Dr. Skeptismo! I’m sure. First of all, okay, there’s the feeling. (Chandler shrugs) Okay, and for another, how about the fact that she went into my guitar case which is lined with orange felt. (Rachel nods her head in unsure agreement) My Mother’s favourite fish is Orange Roughy... (Joey thinks he understands, but then nods that he has no clue.) Cats....like....fish! (Ross and Rachel are totally lost) (to the cat) Hi, Mommy. (Rachel covers her mouth, in an “Oh my God.” gesture) Oh, I haven’t seen this smile in 17 years!"
dialogue,Joey,"(to Chandler) Dude, Phoebe’s mom has got a huge peni..."
dialogue,Chandler,(interrupting) Let it go!!
heading,,"[Scene: Monica and Rachel's, Rachel is working as Monica enters.]"
dialogue,Monica,Hey!
dialogue,Rachel,"Umm, when were you gonna tell me that you’re going out with Chip Matthews?"
dialogue,Monica,Now? Is it okay if I go out with Chip Matthews?
dialogue,Rachel,Nooo! It’s not okay! I can’t believe you would want to after what he did to me!
dialogue,Monica,"What, that little thing at the prom?"
dialogue,Rachel,Monica! I couldn’t find him for two hours! He was having sex with Amy Welch!
dialogue,Monica,"Come on, that was back in high school! How could that still bother you?"
dialogue,Rachel,"I mean why, of all people would you want to go out with Chip?!"
dialogue,Monica,"Look, you and I went to different high schools..."
dialogue,Rachel,"Okay, that doesn’t help me, because we went to the same high school."
dialogue,Monica,"You went to one where you were popular, and you got to ride off Chip’s motorcycle, and wear his letterman jacket. I went to one where I wore a band uniform they had to have specially made."
dialogue,Rachel,(shocked) They had to have that specially made?!
dialogue,Monica,It was a project for one of the Home Ec classes.
dialogue,Rachel,"(stunned) Oh my God, they told us that was for the mascot!"
dialogue,Monica,"Back then, I thought that I would never, ever get the chance to go out with a Chip Matthews, and now he’s-he’s called me up and asked me out. And the fat girl inside of me really wants to go. I-I owe her this. I never let her eat."
dialogue,Rachel,"Oh, you go out with him. (goes over and hugs her)"
dialogue,Monica,"Oh, really?!"
dialogue,Rachel,"Yeah. Just, if it’s possible, could you leave him somewhere and go have sex with another guy?"
dialogue,Monica,I’ll try.
heading,,"[Scene: Monica and Rachel's, the next morning, they are all there eating breakfast.]"
dialogue,Ross,So you guys having any luck getting rid of the entertainment center?
dialogue,Joey,"Well, there were a couple of calls last night, but ah, I don’t think any of them are gonna work out."
dialogue,Chandler,"Yes, Joey has a very careful screening process. Apparently, not everyone is qualified to own wood and nails."
dialogue,Phoebe,"(is struggling with the cat) Stop it! Stop it! She keeps squirming, trying to get away! Just like when she was alive."
dialogue,Ross,"So Pheebs, how long is your mom gonna be with us?"
dialogue,Phoebe,"Well, I’m not sure. I mean, I guess until she y'know, gets used to the fact that there’s y'know, a new mom. Y'know, I think she’s worried that y'know, she’s gonna, she’s gonna be replaced. (to the cat, in a funny voice) Well, that’s not gonna happen is it? Noo. (gets up) Okay, I have to return a call in the other room."
dialogue,Monica,Why can’t you use the phone in here?
dialogue,Phoebe,"Well, I’m returning a call from a certain mom at the B-E-A-C-H. I just spelled the wrong word. (goes into Monica’s room)"
dialogue,Ross,"So, guys, am I crazy, or does Phoebe’s mom remind anyone of a cat ?"
dialogue,Monica,"Ross, don’t start."
dialogue,Ross,"Come on, you-you can’t tell me you actually believe that-that there’s a woman inside that cat!"
dialogue,Rachel,I believe it.
dialogue,Ross,No you don’t.
dialogue,Rachel,"Yes, I do."
dialogue,Ross,"No you do—y'know what, you’re not gonna suck me into this."
dialogue,Rachel,"Oh sure I am, because you always have to be right."
dialogue,Ross,"I do not always have to be—okay, okay. (starts to leave)"
dialogue,Rachel,Jurassic Park could happen.
action,,"(Ross wants to say something, but just smiles and leaves.)"
heading,,"[Scene: Chandler and Joey's, Joey and Chandler are showing a couple of guys (Tony and Peter) the entertainment center.]"
dialogue,Tony,"Wow! That’s ah, that’s pretty nice!"
dialogue,Joey,Pretty nice?
dialogue,Chandler,"You’ll have to pardon my roommate, he wanted to marry this."
dialogue,Tony,"We don’t have 50 bucks, but would you be willing to trade for it? We’ve got a canoe."
action,,"(Joey jumps up in excitement and without turning around Chandler holds out his hand stopping him, and ushering him back into his seat. Joey sits down, dejected.)"
dialogue,Chandler,"Y'know, I, I really don’t think we need a canoe."
dialogue,Tony,You gotta take the canoe!
dialogue,Chandler,"All right, just, just take the entertainment center, and then when you get home, throw the canoe away!"
dialogue,Peter,We’re not throwing it away! I built that canoe! (starts to leave as Tony chases after him)
dialogue,Joey,(to Peter) Good for you!!
heading,,"[Scene: Central Perk, Chandler, Joey, Monica, and Ross are there.]"
dialogue,Rachel,"(entering) You guys, you’re never gonna believe what I just found tacked up on a telephone pole! (She’s holding a flyer.) Look kinda familiar?"
dialogue,Ross,(taking the flyer) Apparently Phoebe’s mother also goes by the name Julio.
dialogue,Rachel,"You guys, there’s a little girl in Soho looking for this cat. I mean, you know what that means?!"
dialogue,Joey,"(looking at the flyer) Yeah-eah! 200 dollar reward, split five ways!!"
dialogue,Rachel,Do we have to tell her?
dialogue,Ross,"Yes, we have to tell her!"
dialogue,Monica,"Oh, but it’s made her so happy."
dialogue,Ross,"(holds up a hand) Little girl misses her cat. (hold up the other hand) Crazy lady thinks her mother is in a cat. (gets up) Okay, y'know what, I have to go have dinner with my son, can I trust that when you see Phoebe, you will tell her."
dialogue,All,(disappointed) Yeah.
dialogue,Ross,Thank you.
dialogue,Rachel,I hate when Ross is right!
dialogue,Monica,"He is right, isn’t he?"
dialogue,Chandler,"Y'know what, I think this might be one of the times he’s wrong."
dialogue,All,You think?
dialogue,Chandler,"Oh-no, he’s right."
action,,Commercial Break
heading,,"[Scene: Central Perk, the same scene is continued from before the break. With Joey, Monica, Rachel, and Chandler sitting on the couch.]"
dialogue,Phoebe,"(entering, with Julio) Hi. (sits down in the chair)"
dialogue,Monica,Hi!
dialogue,All,Hey!
dialogue,Joey,"Uh, Pheebs, about your mom..."
dialogue,Phoebe,Yeah?
dialogue,Joey,(pause) How’s that going?
dialogue,Phoebe,"So great. Oh, we took a nap today and my Mom fell asleep on my tummy and purred."
dialogue,Joey,That’s so sweet. (pause) I’m gonna get some coffee. (gets up and leaves)
dialogue,Monica,(sliding into Joey’s place on the couch to try and talk to Phoebe) Huh? What’d ya say Joe? I’ll be right there. (gets up and joins Joey)
action,,(Rachel and Chandler slide into position.)
dialogue,Rachel,Pheebs...
dialogue,Phoebe,"I just feel so, uhh....."
dialogue,Rachel,All right!!
dialogue,Chandler,I’m coming already!!
dialogue,Rachel,Jeez!
action,,(They both get up and leave Phoebe alone.)
heading,,"[Scene: Monica and Rachel's, Rachel is reading at the kitchen table as there is a knock on the door.]"
dialogue,Monica,"(running from the bathroom to her room, wearing only a towel) Not yet! Not yet! Not yet! Not yet! Not yet! Not yet! Not yet! Not yet! (gets to her room and closes the door, as Rachel gets up to answer the door.)"
dialogue,Rachel,"Hello, Chip."
dialogue,Chip,"Hey, Rach! How ya doin’?"
dialogue,Rachel,"I’m great! I’m great. I’ve got a great job at Bloomingdale’s , have wonderful friends, and eventhough I’m not seeing anyone right now, I’ve never felt better about myself."
dialogue,Chip,"So ah, Monica ready yet?"
dialogue,Rachel,"She’ll be out in a second. So, Chip, how’s umm, Amy Welch?"
dialogue,Chip,"Amy Welch? Wow! I haven’t seen her since... So, Monica about ready?"
heading,,"[Scene: Chandler and Joey's, Joey is showing off the entertainment center.]"
dialogue,Joey,"This is the unit for you my friend. Sturdy construction, tons of storage compartments, some big enough to fit a grown man."
dialogue,Guy,What?!
dialogue,Joey,"Oh yeah! I got in there myself once. My roommate bet me five bucks that I couldn’t, and then he stuck a board through the handles that locked me in. Yeah. It was funny ‘til I started feeling like I was in a coffin."
dialogue,Guy,"No, you, you can’t fit in that thing. That’s not deep enough."
dialogue,Joey,"Oh yeah? (opens up the center and takes out the stereo) If I can’t, I’ll knock five bucks off the price off the unit."
dialogue,Guy,"All right, you have yourself a deal. (shakes his hand)"
dialogue,Joey,Okay. (he gets in the unit and closes the door) See?! I told ya!
action,,(The guys takes a hockey stick and slips it through the handles then proceeds to take the stereo and Chandler’s computer and walk out.)
dialogue,Joey,"Sometimes I get in here just to get away from it! Hey, a nickel!!"
heading,,"[Scene: A street, Chip is walking Monica to his motorcycle.]"
dialogue,Chip,"Here, we are."
dialogue,Monica,Oh my God! You still have the Chipper!
dialogue,Chip,The what?
dialogue,Monica,"That’s what we used to call your ah, your motorcycle in high school. Y'know how a motorcycle is a Chopper, and you’re Chip. Nevermind."
dialogue,Chip,"No, I think it’s cute. (kisses her)"
dialogue,Monica,Wow! A lipper from Chipper.
dialogue,Chip,So you still in touch with anyone from high school?
dialogue,Monica,"Umm. Well, there’s Rachel, and umm, I think that’s it. How bout you?"
dialogue,Chip,"Oh yeah, I still hang with Simmons and Zana, y'know. I see Spindler a lot. Devane, Kelly, and I run into Goldie from time to time. Steve Brown, Zuchoff, McGwire, J.T., Breadsly."
dialogue,Monica,Is that all?
dialogue,Chip,"Ehh, y'know after high school, you just kinda lose touch. Oh yeah! I ran into Richard Dorfman."
dialogue,Monica,"Ohh, how is he?"
dialogue,Chip,"Not so good, Simmons and I gave him a wedgie."
dialogue,Monica,Isn’t he an architect now?
dialogue,Chip,"Yeah, they still wear underwear."
heading,,"[Scene: Chandler and Joey's, Chandler is coming home. As we walks through the door, and without looking up, he goes to throw his keys on the foosball table, only, it’s gone and the keys it the floor. He then looks up at an empty apartment; everything is gone except for the entertainment center and that ceramic dog. Even the food in the fridge!]"
dialogue,Chandler,OH MY GOD!!!
dialogue,Joey,(still trapped in the entertainment center) WHAT?!!
dialogue,Chandler,Are you all right?!
dialogue,Joey,Yeah...
dialogue,Chandler,(lets him out) What happened?!!
dialogue,Joey,"(getting out) Awww, man! He promised he wouldn’t take the chairs!!"
dialogue,Chandler,What the hell happened?!! How were you locked in?!! And where the hell is all of our stuff?!!
dialogue,Joey,"Well, this guy came by to look at the unit and-and he said he didn’t think big enough to fit a grown man!"
dialogue,Chandler,So—You got in voluntarily ?!
dialogue,Joey,"I was tryin’ to make a sale!! Oh, man, if I ever run into that guy again, do you know what I’m gonna do?"
dialogue,Chandler,BEND OVER?!!!
heading,,"[Scene: Dot’s Spot, Chip and Monica are on there date, eating dinner. Chip is telling a story.]"
dialogue,Chip,"...and then Zana, just let one rip!! (laughs histerically)"
dialogue,Monica,"Look, not that I enjoy talking about people who I went to high school with, ‘cause I do, but umm, maybe we could talk about something else? Like you, I don’t even know where you work?"
dialogue,Chip,You know where I work!
dialogue,Monica,I do?
dialogue,Chip,"The movie theatre, you used to come in all the time."
dialogue,Monica,You still work at the multiplex?
dialogue,Chip,"Oh, like I’d give up that job! Free popcorn and candy, anytime I want. I can get you free posters for your room."
dialogue,Monica,"Thanks, I’m set. Do you still live with your parents?"
dialogue,Chip,"Oh yeah, but I can stay out as late as I want."
action,,(Monica takes a big swig of her martini.)
heading,,"[Scene: Chandler and Joey's, Rachel, Phoebe, and Julio are consoling Joey and Chandler.]"
dialogue,Rachel,Wow! They really got you guys. Your T.V. The chairs.
dialogue,Phoebe,"Oh yeah, your microwave. The stereo."
dialogue,Joey,"(looking through a deck of cards) Aww, man, he took the five of spades!! Oh, no-no-no, here it is!"
dialogue,Monica,(entering) Oh my God! What happened?
dialogue,Chandler,"Oh, umm, Joey was born, and then 28 years later, I was robbed!!"
dialogue,Rachel,"(to Monica) So, how was your date?"
dialogue,Monica,"Well, y'know how I always wanted to go out with Chip Matthews in high school?"
dialogue,Rachel,Um-hmm.
dialogue,Monica,"Well, tonight, I actually went out with Chip Matthews in high school."
dialogue,Rachel,"Oh honey, I’m sorry."
dialogue,Monica,"No, it’s okay, not only did I get to go out with Chip Matthews, I got to dump Chip Matthews."
dialogue,Rachel,Ohh! That’s so great!
dialogue,Monica,I know!
dialogue,Ross,"(entering) Hey! So ah, what did the insurance company say?"
dialogue,Chandler,"Oh, they said uh, “You don’t have insurance here, so stop calling us.”"
dialogue,Ross,"(seeing Phoebe still with cat) You didn’t tell her?! (They all kinda shy away.) Okay, fine! Pheebs?"
dialogue,Phoebe,Yeah? (sees Ross) Hi!
dialogue,Ross,"Hi! Listen uhh, this cat belongs to a little girl. There are flyers all over the place."
dialogue,Rachel,"I’m sorry, sweetie. (shows her the flyer)"
dialogue,Monica,"Hey, we can take her back with you if you want."
dialogue,Phoebe,"Ohh. Um-hmm. But y'know, she choose to find me. I mean, I have to respect her decision. Right?"
dialogue,"Chandler, Monica, Joey, and Rachel",That’s a good call. Right.
dialogue,Ross,"No! No! Look—Hey, enough is enough! Look, I am sorry that you feel guilty or whatever about spending time with your new mom, but this is not your old mom. This is a cat! Okay, Julio the cat! Not mom! Cat!"
dialogue,Phoebe,"(she turns around and puts the cat on the entertainment center) Ross, how many parents have you lost?"
dialogue,Ross,None.
dialogue,Phoebe,"Okay, then you don’t know what it feels like when one of them comes back. Do you? I believe this is my Mother. Even if I’m wrong, who cares? Just be a friend. Okay? Be supportive."
dialogue,Ross,I’m sorry.
dialogue,Phoebe,Okay.
dialogue,Ross,I don’t know what to say.
dialogue,Rachel,You could.... say you’re sorry to her mom.
dialogue,Phoebe,I think she would like that.
dialogue,Ross,"(goes over to Julio) Come here, here, come here, come here, (pause) Mrs. Buffay. Sorry, about what I said, umm, it was, it was insensitive of me to say that you were just a cat. When clearly you are also the reincarnated spirit, of my friend’s mother."
dialogue,Phoebe,Thank you. We both forgive you.
dialogue,Rachel,"So honey, what are you gonna do about the little girl?"
dialogue,Phoebe,"Yeah, okay, listen, umm, Mom, I hope you know you still mean a lot to me. And you’re welcome to come back anytime."
dialogue,Chandler,"Pheebs, if she could come back as a couch, we’d really appreciate it. (Joey nods in agreement)"
dialogue,Phoebe,"Come on, Mom, I’ll take you home."
dialogue,Rachel,I’ll go with you.
dialogue,Monica,Me too. (they all leave)
dialogue,Ross,"Oh! Y'know, I’ve got an extra futon."
dialogue,Joey,"Dude, you don’t have to brag! We got nothing here!!"
action,,Closing Credits
heading,,"[Scene: Chandler and Joey's, Joey and Chandler have trading the entertainment center for the canoe. Joey is sitting in the bow, staring off into space as to envision his future full of possibilities. Chandler is sitting at the stern, staring into space and is looking at an uncertain future.]"
action,,End
