script_element,character,text
dialogue,Mike,Don't point your finger at me .
dialogue,David,Why? Wh-What are you going to do about it?
dialogue,Mike,Well... I'll... just show you what I'm gonna do about it... (he hits David's finger with his finger and they start to finger-fight using their fingers as swords saying all kinds of macho crap)
dialogue,Phoebe,"Stop it! Stop it, before someone gets really hurt! (they stop and Phoebe gets David's jacket and gives it to him) Here David, you should just go."
dialogue,David,"Allright... But... if I ever do come back from Minsk... (points at Mike) well, you just better watch out."
dialogue,Mike,"Well, if I ever go to Minsk, you 'd better watch out."
dialogue,David,"Oh, you're going to Minsk?"
dialogue,Mike,"Well, I might."
dialogue,David,"Really? Well, if you do, come in the spring. It's just lovely there."
dialogue,Phoebe,"Okay, well... guys?"
dialogue,David,Right... Goodbye Phoebe. (Makes a move to kiss her.)
dialogue,Mike,"Hey, what are you kidding me?"
dialogue,David,"Right-o, right-o... (to Mike) Take good care of her. (and he leaves)"
dialogue,Phoebe,"I'm sorry, I'm so sorry. If you... If you want your key back, I totally understand."
dialogue,Mike,It's never gonna happen again right?
dialogue,Phoebe,Right! Never! Never! I swear! (They kiss... The door opens and David comes in again.)
dialogue,David,"I-I... Oh I...I just wanna say uhm... if you do ever come to Minsk, that's my number (gives Mike a business card) We'll uhm... we'll party up Vladnik style. (He leaves again)"
heading,,"[Scene: Ross walks in the hallway to his apartment and stops in front of his own door. Now he hears two recorders playing a song. When he enters, Sandy and Joey are playing the recorder and Rachel listens.]"
dialogue,Joey,"Yeah! Allright! Hey, hey Ross. Check it out! Sandy taught me Hot-cross Buns."
dialogue,Ross,Really? Sounded like Three Blind Mice.
dialogue,Joey,Noooo... Three Blind Mice goes like this... (he puts his fingers in position on the recorder)
dialogue,Ross,(looks angrily at Joey and points at him) I swear to God...! (Joey is in shock)
dialogue,Sandy,Who's up for puppets?
dialogue,Joey,Me! I'm up for puppets!
dialogue,Sandy,"Well, please welcome... The Snufflebumps... Who wants to be mr. Wigglemunch and who's gonna be the Grumpus?"
dialogue,Ross,"Okay, okay... How exactly is a two month old supposed to appreciate puppets?"
dialogue,Sandy,Actually studies have shown that the movement and colours help their cerebral development... The whimsical characters are just for us. (He winks to Joey and Rachel. Ross's face says he disapproves. Joey sees that and kind of angrily says...)
dialogue,Joey,"I wanna be mr. Wigglemunch. (and makes a ""there"" nod to Ross)"
dialogue,Ross,(shakes his head) Oh my God!
dialogue,Sandy,"Well, I guess we know who's gonna be the Grumpus... (Ross goes to the kitchen)"
heading,,[Scene: Ross and Rachel's kitchen. Ross got a beer from the refrigerator and opens the bottle. Rachel now also enters the kitchen.]
dialogue,Rachel,That was kind of rude!
dialogue,Ross,"Oh, I'm sorry. Please apologise to Sandy and the Snufflebumps for me."
dialogue,Rachel,"You know, he was just doing his job..."
dialogue,Ross,"Well, you know what... I-I'm sorry I'm the only one who isn't in love with Gary Poppins out there... But I just... I can't... I can't go through with this."
dialogue,Rachel,"Oh, come on Ross..."
dialogue,Ross,"No! Hey, you know what? I'm sorry. I would never force you... to hire someone you were this uncomfortable with..."
dialogue,Rachel,(sighs) Oh... That's true.
dialogue,Ross,Thank you!
dialogue,Rachel,"Well, you're the one who wants to fire him, so you're gonna have to do it. (Ross walks to the living room determined to fire Sandy)"
heading,,[Scene: Living room. Joey and Sandy are talking with the Snufflebumps.]
dialogue,Sandy,"(In a puppet voice) So you see Wigglemunch, that's why it's important to shaaaaaaare..."
dialogue,Joey,(kind of emotional) I am learning so much from you.
heading,,[Scene: Monica and Chandler's apartment. Monica and Joey are sitting at the dinner table. Chandler comes from the bedroom with his suitcase.]
dialogue,Chandler,"Well, I'm off to Tulsa, so if your Maitre D. friend has any funny Oklahoma jokes, tell him to e-mail me at www.hahanotsomuch.com ."
dialogue,Monica,"Honey, you can relax. Last night at work, Geoffrey told this really sexist joke. After that, not so funny anymore."
dialogue,Chandler,"Really...? See... that's the thing: you gotta keep it smart, people!"
dialogue,Monica,"Okay, don't miss that flight. You know I love you."
dialogue,Chandler,I love you too. (Monica and Chandler kiss. He turns to Joey.) And... I like you as a friend. (They hug and pat each other on the back.)
dialogue,Joey,Allright. See you later!
dialogue,Chandler,See ya! (he leaves the apartment)
dialogue,Joey,(to Monica) Did that guy really make that joke?
dialogue,Monica,"Naaaa... He still kills me. Last night he had me laughing so hard, I swear... a little pee came out."
heading,,[Scene: Ross and Rachel's apartment. Sandy is knitting baby clothes. Ross and Rachel walk into the living room.]
dialogue,Ross,Here goes...
dialogue,Rachel,I can't watch. It's like firing Elmo. (Ross walks to the couch where Sandy sits)
dialogue,Ross,"Sandy... Hi, we uhm... we kinda need to talk. I'm afraid it's not working out."
dialogue,Sandy,(surprised) Oh...
dialogue,Ross,"Yeah, uhm... I mean, Rachel and I, think you are great... with Emma... uhm... We just feel..."
dialogue,Rachel,(from behind the bedroom door) YOU! You feel!
dialogue,Ross,I... just feel that the... the chemistry isn't right. I'm sorry. We're... we're more than happy to give you good recommendation...
dialogue,Sandy,"Oh, no, no, no... That's okay. I got a lot of offers from other families. I just picked you guys because... I liked you the best."
dialogue,Rachel,"(from bedroom) Oh, damn you Geller!"
dialogue,Ross,"Anyway, uhm...Well, I'm glad there's no hard feelings."
dialogue,Sandy,"No, none at all. You need to be happy with whoever is in your home... Although if you don't mind telling me, what was your problem? Maybe it's something I can work on in the future."
dialogue,Ross,"No, you know, it's uhm... nothing you did, it's... it's uhm... my issue."
dialogue,Sandy,What is it...? (Ross hesitates) Please...? (he tilts his head)
dialogue,Ross,"You know, I'm just not uhm... that comfortable with a guy who's as sensitive as you."
dialogue,Sandy,"That's fair... Although, can I ask... why do you think that is?"
dialogue,Ross,Why... I... I don't know. (Sandy tilts his head again) Uhm... errrr... maybe... maybe because of my father?
dialogue,Sandy,hmmm... (and shakes his head)
dialogue,Ross,"I mean, uhm... you know when I was growing up he was kind of a tough guy... You know a-a-and as a kid I wasn't the athlete I am now."
dialogue,Rachel,(from the bedroom) Huh ha ha!
dialogue,Ross,"I play squash...! Anyway, uhm... I uhm... I always get the feeling he thought I was too sensitive."
dialogue,Sandy,That must have been hard.
dialogue,Ross,"It was hard... I remember... I was in my bedroom... playing with my dinosaurs... playing and learning ... and my father walks in and says... he says... ""What are you doing with those things? What's wrong with you, why aren't you... why aren't you outside playing like a... like a real boy?"
dialogue,Sandy,But you are a real boy!
dialogue,Ross,"I know I am! (Ross now starts to cry) ...And when it's summer, and it's hot, why can't you wear a tank top?"
dialogue,Sandy,It's allright! Crying is good. It lets the boo-hoos out.
dialogue,Ross,Here come some more...
action,,Commercial Break
heading,,"[Scene: Joey's apartment. Joey and Sandy are sitting at the kitchen counter. Joey is holding mr. Wigglemunch, and Sandy holds the Grumpus.]"
dialogue,Sandy/Grumpus,"And what's the one kind of boat that can never, ever sink?"
dialogue,Joey/Wigglemunch,What kind?
dialogue,Sandy/Grumpus,A friend-ship...
dialogue,Joey,Wow! You blow my mind...
dialogue,Sandy,"Oh, I gotta go."
dialogue,Joey,Aaahh... How much do I owe you?
dialogue,Sandy,Twenty bucks.
dialogue,Joey,It's like the cheapest college ever.
action,,End
