script_element,character,text
dialogue,Phoebe,"Okay, not a fan of the tough love."
dialogue,Precious,I just can't believe that Mike didn't give me any warning.
dialogue,Phoebe,"But he didn't really know, you know. He wasn't planning on coming to Barbados and proposing to me..."
dialogue,Precious,He proposed to you? This is the worst birthday ever . (she starts to cry again)
dialogue,Phoebe,"Look, Precious... Mike's not worth this. You're an attractive, intelligent woman and let's face it, Mike's kind of a wang. I mean, he proposed to me while he was still seeing you... He was gonna break-up with you on your birthday ? And, I don't like to kiss-and-tell, but he cheated on you a lot this weekend."
dialogue,Precious,"Oh, my God, maybe you're right. Maybe I don't need him. I deserve to be treated with respect."
action,,(Mike enters the apartment.)
dialogue,Precious,"Screw you, Mike. You're a coward and a bastard, and I hope you rot in hell."
action,,"(she slaps him in the face, Mike looks like he doesn't believe what just happened. Precious leaves, and he turns to Phoebe.)"
dialogue,Phoebe,You're welcome!
heading,,[Scene: Chandler and Monica's. Only Chandler is in the living room and walks to the bathroom.]
dialogue,Chandler,"Honey, you've been in there for a long time... Is everything okay?"
dialogue,Monica,Not really.
action,,"(Chandler enters the bathroom, and Monica is standing there in a towel, with her hair stuck in the shower curtain.)"
dialogue,Monica,I have a problem.
dialogue,Chandler,Really? What happened?
dialogue,Monica,"Well, I was dancing around, and singing ""No Woman, No Cry"" and I got stuck."
dialogue,Chandler,You can't move at all?
dialogue,Monica,"Oh, well, I can move... (she moves back and forth the shower curtain rail, opening and closing the shower curtain with her hair as she goes)"
dialogue,Chandler,"If I untangle you, will you please get rid of the corn rose?"
dialogue,Monica,(looking disappointed) I guess so...
dialogue,Chandler,(trying to untangle her) Some of these look a little frayed.
dialogue,Monica,"Yeah, I tried to gnaw myself free."
heading,,[Scene: Rachel and Joey's apartment. Joey enters.]
dialogue,Joey,Hey!
dialogue,Rachel,Hi!
dialogue,Joey,"So, did you err... did you tell Ross?"
dialogue,Rachel,"Well, I tried, but then he had a shampoo related emergency. So I guess now it's your turn again."
dialogue,Joey,"No, no, no, no, no, no, no, no... I think it's better if you tell him, you know. It's easier for a woman. That way, you know, if he gets mad, all you have to do is go... I didn't mean it. I'm so so--ooory. (he pushes his breasts together from the side)"
dialogue,Rachel,"Yeah, 'cause that's what we do."
dialogue,Joey,"Alright, alright, okay, uhm... How 'bout this, how about this? Tomorrow... tomorrow we'll both go and we'll tell him together."
dialogue,Rachel,"Okay, that sounds fair. It just means that once again we can't..."
dialogue,Joey,"I know, I know..., but that's okay. I mean, we can control ourselves, we're not animals."
dialogue,Rachel,"No! Of course we can wait. Alright, so I guess that means good night then?"
dialogue,Joey,"Yeah! Good night! (they give each other a small kiss on the mouth, and stare at each other for a while)"
dialogue,Rachel,Goo--ood night!
dialogue,Joey,"Good night! (they give each other a kiss again, but this time it lasts longer)"
dialogue,Rachel,"Seriously, good night!"
dialogue,Joey,Stop saying good night.
dialogue,Rachel,Okay.
action,,"(Now they kiss passionately... and then Ross enters with Emma. They freeze, pull away and look at Ross who looks like he just can't believe what he's seeing. Joey straightens his shirt, and Rachel says I'm so-oo sorry , and presses her breasts together, just like Joey did before.)"
action,,Commercial Break
heading,,[Scene: Monica and Chandler's. Monica walks in with one of those knitted Rasta hats.]
dialogue,Monica,Look what I found in the drawer... (Chandler looks up from his book.) And you said I'd never wear this...
dialogue,Chandler,"Now that I untangled you, how 'bout you doing a little something for me?"
dialogue,Monica,"Sure, what do you have in mind?"
dialogue,Chandler,I think you know.
dialogue,Monica,Really? I don't really feel like it.
dialogue,Chandler,This is what I want to do.
dialogue,Monica,"Okay, I just don't get why you like it so much."
dialogue,Chandler,"(Picks up the ""Miss Congeniality"" DVD) She's an FBI agent, posing as a beauty contestant."
action,,THE END
